questionId,category,state,question,optionA,optionB,optionC,optionD,correctAnswer
TN-010,gdlLicensing,TN,"What happens if a Tennessee intermediate driver commits a violation?","A written warning is issued with no impact on the intermediate license","License revocation for 1 year or until the driver reaches age 18","Points are added to the record but no suspension occurs for violation","A fine is assessed but the intermediate license remains unchanged",B
ME-009,gdlLicensing,ME,"Who must supervise a Maine permit holder?","Any driver with a valid license regardless of age or experience may supervise","Licensed driver 20 or older with at least 2 years experience required","Only a parent may supervise regardless of the parent's license status","Any adult over the age of 18 with a valid license may supervise",B
MA-007,gdlLicensing,MA,"After 6 months how many passengers can Massachusetts junior operators carry?","No passenger limits apply after the initial 6 month restriction period","1 passenger under 18 or any number of immediate family members","A maximum of 2 passengers of any age may ride after 6 months","Same restrictions as the first 6 months apply for the entire year",B
MN-009,gdlLicensing,MN,"Who must supervise a Minnesota permit holder?","Any driver with a valid license regardless of age or experience may supervise","Licensed driver 21 or older or a certified driving instructor required","Only a parent may supervise regardless of the parent's license status","Any adult over the age of 18 with a valid license may supervise",B
NV-030,insurance,NV,"What happens if you drive without insurance in Nevada?","First offense results in a written warning with no immediate consequences","Fine and license and registration suspension may be imposed","Points are added to your record but no suspension occurs for first offense","A small fine is typical for first-time offenders with no other penalties",B
NJ-008,gdlLicensing,NJ,"Who must supervise a New Jersey permit holder?","Any driver with a valid license regardless of age or experience may supervise","Licensed driver 21 or older with at least 3 years experience required","Only a parent may supervise regardless of the parent's license status","Any adult over the age of 18 with a valid license may supervise",B
NC-009,gdlLicensing,NC,"Who must supervise a North Carolina permit holder?","Any driver with a valid license regardless of age or experience may supervise","Licensed driver 21 or older with at least 5 years experience required","Only a parent may supervise regardless of the parent's license status","Any adult over the age of 18 with a valid license may supervise",B
OR-038,stateUnique,OR,"What should Oregon drivers know about mountain passes?","Oregon does not have significant mountain terrain affecting state roads","Winter conditions may require chains or traction tires on passes","Tire chains are always required on all mountain passes year-round","Mountain passes in Oregon are closed entirely during winter months",B
RI-008,gdlLicensing,RI,"Who must supervise a Rhode Island permit holder?","Any driver with a valid license regardless of age or experience may supervise","Licensed driver 21 or older with at least 5 years experience required","Only a parent may supervise regardless of the parent's license status","Any adult over the age of 18 with a valid license may supervise",B
RI-037,stateUnique,RI,"What should Rhode Island drivers know about bridge tolls?","Rhode Island does not have any toll bridges anywhere in the state","Some bridges have tolls including the Newport Bridge crossing","All bridges in Rhode Island are completely free for all vehicles","Only commercial trucks are required to pay tolls on Rhode Island bridges",B
VA-029,insurance,VA,"What is unique about Virginia insurance requirements?","Virginia insurance requirements are the same as most other US states","Insurance is optional if you pay the uninsured motorist fee instead","Insurance is always required with no exceptions under Virginia law","Virginia insurance requirements have no unique features to note",B
WA-008,gdlLicensing,WA,"Who must supervise a Washington permit holder?","Any driver with a valid license regardless of age or experience may supervise","Licensed driver 21 or older with at least 5 years experience required","Only a parent may supervise regardless of the parent's license status","Any adult over the age of 18 with a valid license may supervise",B
WV-040,stateUnique,WV,"What should West Virginia drivers know about deer?","Deer are not a significant driving concern on West Virginia roadways","High deer population with many collisions especially in fall months","Deer crossings are limited to the eastern panhandle region only","Marked wildlife crossing zones with reduced speeds alert to deer areas",B
LA-010,gdlLicensing,LA,"What happens if a Louisiana teen accumulates traffic violations?","A written warning is issued with no impact on the teen driving license","License suspension and required completion of remedial training","Points accumulated by teen drivers clear automatically at age 18","A fine is assessed but the teen driving license remains unchanged",B
MA-009,gdlLicensing,MA,"Who must supervise a Massachusetts permit holder?","Any driver with a valid license regardless of age or experience may supervise","Licensed driver 21 or older with at least 1 year experience required","Only a parent may supervise regardless of the parent's license status","Any adult over the age of 18 with a valid license may supervise",B
MN-018,cellPhone,MN,"Can Minnesota drivers use phones while stopped in traffic?","Yes phone use is permitted when the vehicle is completely stopped","No cannot use handheld phone even in traffic or at red lights","Phone use is only permitted for emergency calls when stopped","Only hands-free phone calls are permitted when stopped in traffic",B
MS-012,gdlLicensing,MS,"Can Mississippi issue hardship licenses?","No Mississippi does not issue hardship licenses under any circumstances","Yes for those 14 and older who demonstrate a legitimate need","Hardship licenses are only available for farm work purposes","Hardship licenses are only available after the driver reaches age 16",B
MS-034,stateUnique,MS,"What should Mississippi drivers know about severe weather?","Mississippi has a mild climate with minimal severe weather concerns","Tornadoes and severe thunderstorms can develop very quickly here","Only coastal hurricanes are a concern for Mississippi drivers","Severe weather events are rare and provide plenty of advance warning",B
MT-006,gdlLicensing,MT,"How many passengers can a Montana first-year restricted driver carry?","No passenger limits apply once the restricted license has been issued","1 non-family passenger under 18 for the first 6 months of driving","A maximum of 2 passengers of any age may ride during restricted period","Only immediate family members may ride for the entire restricted year",B
NH-010,gdlLicensing,NH,"What happens if a New Hampshire youth operator commits a violation?","A written warning is issued with no impact on the youth operator license","20-day suspension for first offense then 45 days then 90 days","Points are added to the record but no suspension occurs for violation","A fine is assessed but the youth operator license remains unchanged",B
NJ-009,gdlLicensing,NJ,"Is driver education required in New Jersey?","No driver education is completely optional for all new drivers","Yes 6 hours of behind-the-wheel training required for all under 18","Only the classroom portion of driver education is required","Driver education is only required for those under the age of 17",B
OK-008,gdlLicensing,OK,"Who must supervise an Oklahoma permit holder?","Any driver with a valid license regardless of age or experience may supervise","Licensed driver 21 or older or a licensed parent or guardian required","A licensed driver 25 years of age or older must supervise at all times","Any adult over the age of 18 with a valid license may supervise",B
SD-012,gdlLicensing,SD,"Can South Dakota issue hardship permits?","No South Dakota does not issue hardship permits under any circumstances","Yes through the restricted minor permit program for those with need","Hardship permits are only available for farm work purposes in the state","Hardship permits are only available after the driver reaches age 15",B
SD-034,stateUnique,SD,"What should South Dakota drivers know about winter driving?","Winters in South Dakota are mild with limited snowfall most years","Severe winters with blizzards and extreme cold are common here","Significant snowfall is rare and roads are cleared within hours","Tire chains are required by law on all vehicles during winter",B
VT-016,cellPhone,VT,"What are the penalties for cell phone violations in Vermont?","Violations result in a flat 25 dollar fine regardless of offense history","Up to 200 dollars for first offense and up to 500 for subsequent","Violations result in a flat 50 dollar fine regardless of offense history","First offense results in a written warning with no monetary fine",B
WI-010,gdlLicensing,WI,"What happens if a Wisconsin probationary driver violates restrictions?","A written warning is issued with no impact on the probationary license","License suspension for 6 months or until the driver reaches age 18","Points are added to the record but no suspension occurs for violation","A fine is assessed but the probationary license remains unchanged",B
WI-037,stateUnique,WI,"What should Wisconsin drivers watch for in rural areas?","Nothing special distinguishes rural Wisconsin roads from other areas","Farm equipment deer and Amish horse-drawn vehicles on roads","Wildlife concerns are only present near designated farm areas","Wildlife is only a concern during the fall harvest season months",B
AZ-010,gdlLicensing,AZ,"What happens if you violate graduated license restrictions in Arizona?","A written warning is issued with no impact on the graduated license","Fine and possible extension of the restricted license period","Immediate license revocation for any violation of restrictions","Points are added to record but no extension of restricted period",B
AR-023,duiStateLaws,AR,"What can happen if you refuse a chemical test in Arkansas?","No penalty results from refusing a chemical test in Arkansas","License suspension and refusal may be used as evidence","Only a small fine is assessed for refusing a chemical test","The case is dismissed if you refuse to take a chemical test",B
IL-038,stateUnique,IL,"What is the fine for violating Scott's Law in Illinois?","Violations result in a fine of 100 dollars for first offense","Minimum 250 dollars and up to 10000 dollars if injury occurs","Violations result in a fine of 50 dollars for first offense","A written warning is issued for first offense with no fine",B
KY-022,duiStateLaws,KY,"What happens if you refuse a BAC test in Kentucky?","A written warning is issued with no immediate license consequences","License suspension and refusal may be used as evidence","A 30-day administrative suspension is applied for refusal","Refusal is treated the same as passing the test with no penalty",B
