questionId,category,state,question,optionA,optionB,optionC,optionD,correctAnswer
KY-006,gdlLicensing,KY,"How many passengers can a Kentucky intermediate license holder carry?","No passenger limits apply once the intermediate license has been officially issued","1 unrelated passenger under 20 for first 6 months of driving","A maximum of 2 passengers of any age may ride during the intermediate period","Only immediate family members may ride as passengers during the first year",B
LA-006,gdlLicensing,LA,"How many passengers can a Louisiana intermediate license holder carry?","No passenger limits apply once the intermediate license has been officially issued","1 passenger under 21 for first year unless they are family members","A maximum of 2 passengers of any age may ride during the intermediate period","Only immediate family members may ride as passengers during the first year",B
MD-034,stateUnique,MD,"What should Maryland drivers know about the Baltimore-Washington area?","Standard driving conditions apply similar to other mid-sized metropolitan areas","Heavy congestion and aggressive driving requiring extra patience from drivers","No special driving concerns exist in the Baltimore-Washington corridor area","Lower speed limits are the only difference from other parts of the state",B
MI-008,gdlLicensing,MI,"Who must supervise a Michigan permit holder?","Any driver with a valid license regardless of age or experience may supervise","Licensed parent guardian or designated adult 21 or older must supervise","Only a parent may supervise regardless of the parent's license status","Any adult over the age of 18 with a valid license may supervise",B
MS-024,duiStateLaws,MS,"What is Mississippi implied consent law?","Implied consent refers to consenting to vehicle searches during traffic stops","Operating a vehicle constitutes consent to chemical testing for impairment","Implied consent only applies to field sobriety tests during traffic stops","Implied consent applies only to blood tests and not breath testing",B
MT-024,duiStateLaws,MT,"What is Montana implied consent law?","Implied consent refers to consenting to vehicle searches during traffic stops","Operating a vehicle constitutes consent to chemical testing for impairment","Implied consent only applies to field sobriety tests during traffic stops","Implied consent applies only to blood tests and not breath testing",B
NE-024,duiStateLaws,NE,"What is Nebraska implied consent law?","Implied consent refers to consenting to vehicle searches during traffic stops","Operating a vehicle constitutes consent to chemical testing for impairment","Implied consent only applies to field sobriety tests during traffic stops","Implied consent applies only to blood tests and not breath testing",B
NV-024,duiStateLaws,NV,"What is Nevada implied consent law?","Implied consent refers to consenting to vehicle searches during traffic stops","Operating a vehicle constitutes consent to chemical testing for impairment","Implied consent only applies to field sobriety tests during traffic stops","Implied consent applies only to blood tests and not breath testing",B
NM-024,duiStateLaws,NM,"What is New Mexico implied consent law?","Implied consent refers to consenting to vehicle searches during traffic stops","Operating a vehicle constitutes consent to chemical testing for impairment","Implied consent only applies to field sobriety tests during traffic stops","Implied consent applies only to blood tests and not breath testing",B
NM-034,stateUnique,NM,"What should New Mexico drivers know about dust storms?","Dust storms do not occur in New Mexico due to the mountain terrain patterns","Pull off road turn off lights and wait during dust storms for safety","Drive through dust storms slowly while keeping your headlights on high","Dust storms only occur in remote desert areas far from major highways",B
NC-006,gdlLicensing,NC,"How many passengers can a North Carolina limited provisional driver carry?","No passenger limits apply once the provisional license has been officially issued","1 passenger under 21 unless family or traveling for work or school","A maximum of 2 passengers of any age may ride during the provisional period","Only immediate family members may ride as passengers during the first year",B
ND-012,gdlLicensing,ND,"What is unique about North Dakota permit age?","North Dakota permit age requirements are the same as most other US states","One of the youngest at 14 reflecting the state's rural driving needs","North Dakota has the oldest permit age requirement in the entire nation","North Dakota has no minimum age requirement for obtaining a permit",B
ND-024,duiStateLaws,ND,"What is North Dakota implied consent law?","Implied consent refers to consenting to vehicle searches during traffic stops","Operating a vehicle constitutes consent to chemical testing for impairment","Implied consent only applies to field sobriety tests during traffic stops","Implied consent applies only to blood tests and not breath testing",B
OK-024,duiStateLaws,OK,"What is Oklahoma implied consent law?","Implied consent refers to consenting to vehicle searches during traffic stops","Operating a vehicle constitutes consent to chemical testing for impairment","Implied consent only applies to field sobriety tests during traffic stops","Implied consent applies only to blood tests and not breath testing",B
RI-038,stateUnique,RI,"What should Rhode Island drivers know about coastal driving?","Rhode Island does not have any significant coastal roads for driving","Coastal areas may have fog and heavy tourist traffic in summer","Coastal roads in Rhode Island are always clear with no special concerns","No special rules or considerations apply to coastal driving in the state",B
SC-035,stateUnique,SC,"What is South Carolina law regarding school buses?","Drivers must stop only when traveling on the same side as the stopped bus","Stop in both directions unless divided by a median or physical barrier","Drivers should slow to 25 mph but stopping is not required in most cases","Stop only when the bus driver activates hand signals directed at you",B
SD-040,stateUnique,SD,"What should South Dakota drivers know about open range?","Open range laws are not applicable in South Dakota and all land is fenced","Livestock may be on unfenced roads and drivers must yield to animals","Open range applies only on private ranch land away from public highways","All public roads in South Dakota are fenced to keep livestock off roads",B
UT-037,stateUnique,UT,"What should Utah drivers know about wildlife?","Wildlife is not a significant driving concern on Utah highways and roads","Deer and elk are common road hazards especially in canyon areas","Wildlife is only present within designated national park boundary areas","Marked wildlife crossing zones alert drivers to all potential animal areas",B
UT-040,stateUnique,UT,"What is unique about Utah Express Lanes?","Express lanes do not exist anywhere on Utah highways at this time","HOV and express toll lanes are available on major Utah highways","Express lanes in Utah are completely free for all vehicles at all times","Express lanes in Utah are only available for commercial trucks",B
VT-024,duiStateLaws,VT,"What is Vermont implied consent law?","Implied consent refers to consenting to vehicle searches during traffic stops","Operating a vehicle constitutes consent to chemical testing for impairment","Implied consent only applies to field sobriety tests during traffic stops","Implied consent applies only to blood tests and not breath testing",B
VA-008,gdlLicensing,VA,"Who must supervise a Virginia permit holder?","Any driver with a valid license regardless of age or experience may supervise","Licensed driver 21 or older or family member 18 or older must supervise","Only a parent may supervise regardless of the parent's license status","Any adult over the age of 18 with a valid license may supervise",B
VA-035,stateUnique,VA,"What is Virginia law regarding school buses?","Drivers must stop only when traveling on the same side as the stopped bus","Stop in both directions unless divided by a physical barrier or median","Drivers should slow to 25 mph but stopping is not required in most cases","Stop only when the bus driver activates hand signals directed at you",B
WI-008,gdlLicensing,WI,"Who must supervise a Wisconsin permit holder?","Any driver with a valid license regardless of age or experience may supervise","Licensed driver 21 or older or licensed spouse or parent must supervise","Only a parent may supervise regardless of the parent's license status","Any adult over the age of 18 with a valid license may supervise",B
ME-035,stateUnique,ME,"What is Maine law regarding school buses?","Drivers must stop only when traveling on the same side as the stopped bus","Stop in both directions unless divided by a physical barrier structure","Drivers should slow to 20 mph but stopping is not required in most cases","Stop only when the bus driver activates hand signals directed at you",B
MN-030,insurance,MN,"What happens if you drive without insurance in Minnesota?","First offense results in a written warning with no immediate consequences","License revocation and vehicle plate impoundment may be imposed","Points are added to your record but no suspension occurs for first offense","A small fine is typical for first-time offenders with no other penalties",B
MN-040,stateUnique,MN,"What should Minnesota drivers know about deer?","Deer are not a significant driving concern in Minnesota due to hunting","High deer population with many collisions especially in fall months","Deer crossings are limited to designated state park areas and refuges","Marked wildlife crossing zones with reduced speeds alert to deer areas",B
NE-038,stateUnique,NE,"What is unique about driving in western Nebraska?","Driving in western Nebraska is the same as driving anywhere else in state","Long distances between services and changeable weather require planning","Speed limits in western Nebraska are lower than the rest of the state","Traffic is heavier in western Nebraska due to interstate truck routes",B
NH-034,stateUnique,NH,"What should New Hampshire drivers know about moose?","Moose are rare in New Hampshire and not a significant driving concern","Moose collisions are a serious hazard especially at night in rural areas","Moose are only present within designated state park boundary areas","Marked wildlife crossing zones alert drivers to all moose crossing areas",B
SD-038,stateUnique,SD,"What is unique about driving near Mount Rushmore?","No special driving concerns exist near the Mount Rushmore memorial area","Tourist traffic and winding mountain roads require extra patience","The Mount Rushmore area is closed to public vehicle traffic entirely","Lower speed limits are the only difference from other parts of the state",B
VT-034,stateUnique,VT,"What should Vermont drivers know about winter driving?","Winters in Vermont are relatively mild with limited snowfall most years","Severe winters with snow ice and limited visibility are common","Significant snowfall is rare and roads are cleared within hours of storms","Tire chains are required by law on all vehicles during winter months",B
WA-018,cellPhone,WA,"What makes Washington cell phone law strict?","Washington cell phone law is the same as laws in most other US states","Includes all personal electronic devices not just cell phones","Only cell phones are covered under Washington distracted driving law","Washington cell phone law has no unique features compared to other states",B
WA-030,insurance,WA,"What happens if you drive without insurance in Washington?","First offense results in a written warning with no immediate consequences","Fines license suspension and vehicle impoundment may be imposed","Points are added to your record but no suspension occurs for first offense","A small fine is typical for first-time offenders with no other penalties",B
FL-024,duiStateLaws,FL,"What happens if you refuse a chemical test in Florida?","No penalty results from refusing a chemical test during a traffic stop","License suspension and refusal may be used as evidence against you","A written warning is issued with no immediate license consequences","A fine is the only consequence of refusing a chemical test in Florida",B
MS-017,cellPhone,MS,"Does Mississippi allow voice-to-text while driving?","No voice-to-text is prohibited under Mississippi distracted driving law","Yes voice commands and voice-to-text features are permitted","Only hands-free calling is permitted but not voice-to-text features","Only adult drivers over 21 may use voice-to-text while driving",B
MS-030,insurance,MS,"What happens if you drive without insurance in Mississippi?","First offense results in a written warning with no immediate consequences","Fines license suspension and reinstatement fees may be imposed","Points are added to your record but no suspension occurs for first offense","A small fine is typical for first-time offenders with no other penalties",B
NJ-016,cellPhone,NJ,"What are the penalties for cell phone violations in New Jersey?","Violations result in a flat 25 dollar fine regardless of offense history","200 to 400 first offense then 400 to 600 then 600 to 800 dollars","Violations result in a flat 100 dollar fine regardless of offense history","First offense results in a written warning with no monetary fine assessed",B
NC-040,stateUnique,NC,"What should North Carolina drivers know about deer?","Deer are not a significant driving concern in North Carolina roadways","Deer collisions are common especially in fall and winter months","Deer crossings are limited to designated mountain areas and refuges","Marked wildlife crossing zones with reduced speeds alert to deer areas",B
OR-003,gdlLicensing,OR,"How many hours of supervised driving practice are required in Oregon?","30 hours of supervised driving practice are required for all new drivers","50 hours of supervised driving practice are required for all new drivers","100 hours with parent or 50 hours with certified instructor required","40 hours of supervised driving practice are required for all new drivers",C
VT-038,stateUnique,VT,"What should Vermont drivers know about moose?","Moose are rare in Vermont and not a significant driving concern here","Moose are a serious collision hazard especially at night in rural areas","Moose are only present within designated state park boundary areas","Marked wildlife crossing zones alert drivers to all moose crossing areas",B
VA-040,stateUnique,VA,"What should Virginia drivers watch for in rural areas?","Nothing special distinguishes rural Virginia roads from other areas","Deer especially in fall and slow agricultural equipment on roads","Wildlife concerns are only present near designated state park areas","Wildlife is only a concern during nighttime driving hours in Virginia",B
WA-034,stateUnique,WA,"What should Washington drivers know about mountain passes?","Washington does not have significant mountain terrain affecting roads","Winter conditions may require chains and mountain passes may close","Tire chains are always required on all mountain passes year-round","Mountain passes in Washington never close regardless of weather",B
WV-011,gdlLicensing,WV,"What must West Virginia teens complete for a Level 2 license?","Nothing additional is required beyond the Level 1 permit requirements","Driver education 50 hours practice and passing the road test required","Only passing the written knowledge test is required for Level 2","Only passing the vision screening test is required for Level 2",B
ME-011,gdlLicensing,ME,"What happens if a Maine intermediate driver gets a traffic conviction?","A written warning is issued with no impact on the intermediate license","3-month license suspension for each traffic conviction received","Points are added to the record but no suspension occurs for conviction","A fine is assessed but the intermediate license remains unchanged",B
MA-030,insurance,MA,"What happens if you drive without insurance in Massachusetts?","First offense results in a written warning with no immediate consequences","License and registration revocation plus fines may be imposed","Points are added to your record but no suspension occurs for first offense","A small fine is typical for first-time offenders with no other penalties",B
MI-018,cellPhone,MI,"Can Michigan drivers use phones at red lights?","Yes phone use is permitted when the vehicle is completely stopped","No cannot hold or use phone manually even when stopped at lights","Phone use is only permitted for emergency calls when stopped","Only hands-free phone use is permitted when stopped at red lights",B
MI-028,insurance,MI,"What is unique about Michigan auto insurance?","Michigan auto insurance requirements are the same as most other states","Unlimited or capped PIP coverage options available since 2020 reform","No PIP coverage is required under Michigan auto insurance law","The state of Michigan provides auto insurance directly to residents",B
MI-030,insurance,MI,"What happens if you drive without insurance in Michigan?","First offense results in a written warning with no immediate consequences","License and registration suspension plus fines may be imposed","Points are added to your record but no suspension occurs for first offense","A small fine is typical for first-time offenders with no other penalties",B
NV-006,gdlLicensing,NV,"How many passengers can a Nevada restricted driver carry?","No passenger limits apply once the restricted license has been issued","No passengers under 18 for first 6 months unless family members","A maximum of 1 passenger of any age may ride during restricted period","Only immediate family members may ride for the entire restricted period",B
NH-040,stateUnique,NH,"What should New Hampshire drivers know about fall foliage season?","Fall foliage season does not significantly impact driving conditions","Heavy tourist traffic on scenic routes requires extra patience","Roads close during peak foliage season for leaf removal operations","Speed limits are reduced on all scenic routes during foliage season",B
NY-037,stateUnique,NY,"What should drivers know about New York toll roads?","New York does not operate any toll roads on state highways anywhere","Extensive toll system with E-ZPass and tolls by mail options","Toll roads in New York accept only cash payment at all locations","Toll roads are completely free for New York residents with plates",B
OR-006,gdlLicensing,OR,"How many passengers can an Oregon provisional driver carry in first 6 months?","No passenger limits apply once the provisional license has been issued","No passengers under 20 for first 6 months unless family members","A maximum of 1 passenger of any age may ride during provisional period","Only immediate family members may ride for the entire provisional year",B
OR-030,insurance,OR,"What happens if you drive without insurance in Oregon?","First offense results in a written warning with no immediate consequences","Fines license suspension and SR-22 requirement may be imposed","Points are added to your record but no suspension occurs for first offense","A small fine is typical for first-time offenders with no other penalties",B
SC-006,gdlLicensing,SC,"How many passengers can a South Carolina conditional driver carry?","No passenger limits apply once the conditional license has been issued","No more than 2 passengers under 21 for the first 6 months","A maximum of 1 passenger of any age may ride during conditional period","Only immediate family members may ride for the entire conditional year",B
VT-030,insurance,VT,"What happens if you drive without insurance in Vermont?","First offense results in a written warning with no immediate consequences","Fines up to 500 dollars and license suspension may be imposed","Points are added to your record but no suspension occurs for first offense","A small fine is typical for first-time offenders with no other penalties",B
WI-030,insurance,WI,"What happens if you drive without insurance in Wisconsin?","First offense results in a written warning with no immediate consequences","Fines up to 500 dollars and license suspension may be imposed","Points are added to your record but no suspension occurs for first offense","A small fine is typical for first-time offenders with no other penalties",B
WY-006,gdlLicensing,WY,"How many passengers can a Wyoming intermediate driver carry in first 6 months?","No passenger limits apply once the intermediate license has been issued","No more passengers than seat belts available for the first 6 months","A maximum of 1 passenger of any age may ride during intermediate period","Only immediate family members may ride for the entire intermediate year",B
WY-030,insurance,WY,"What happens if you drive without insurance in Wyoming?","First offense results in a written warning with no immediate consequences","Fines up to 750 dollars and license suspension may be imposed","Points are added to your record but no suspension occurs for first offense","A small fine is typical for first-time offenders with no other penalties",B
CT-034,stateUnique,CT,"What happens to an underage driver's license if they fail a BAC test over 0.02%?","A written warning is issued with no immediate license consequences","45-day suspension plus 1 year IID requirement is imposed","Points are added to the record but no suspension occurs for first offense","Probation is assigned with no immediate impact on driving privileges",B
DE-018,cellPhone,DE,"What exceptions exist for Delaware's cell phone law?","No exceptions exist and all phone use while driving is prohibited","Emergency calls crime reports and hands-free use are permitted","Only work-related calls are permitted under Delaware driving law","Only GPS navigation use is permitted under Delaware driving law",B
GA-040,stateUnique,GA,"What is the penalty for passing a stopped school bus in Georgia?","A fine is the only consequence with no points added to driving record","Up to 1000 dollar fine and 6 points added to driving record","A written warning is issued for first offense with no fine assessed","Only 3 points are added to record with no monetary fine assessed",B
IL-015,cellPhone,IL,"What activities became prohibited for Illinois drivers in January 2024?","All phone use became completely prohibited regardless of method used","Video conferencing and social media use while driving prohibited","GPS navigation use became prohibited under the new Illinois law","Hands-free phone calls became prohibited under the new Illinois law",B
MD-017,cellPhone,MD,"Does Maryland add points for cell phone violations?","No points are added to driving record for any cell phone violation","Yes 1 point for first offense and 3 points for subsequent ones","3 points are always added regardless of whether it is first offense","Points are only added if the violation contributed to a crash",B
MS-011,gdlLicensing,MS,"What happens if a Mississippi intermediate driver violates curfew?","A written warning is issued with no impact on the intermediate license","Extended restrictions and possible license suspension may result","Points are added to the record but no suspension occurs for violation","A fine is assessed but the intermediate license remains unchanged",B
MO-040,stateUnique,MO,"What should Missouri drivers watch for in rural areas?","Nothing special distinguishes rural Missouri roads from other areas","Farm equipment wildlife and unmarked railroad crossings are common","Wildlife concerns are only present on designated state highway routes","Rural Missouri roads are identical to roads found elsewhere in state",B
NJ-035,stateUnique,NJ,"What is New Jersey law regarding school buses?","Drivers must stop only when traveling on the same side as the stopped bus","Stop in both directions unless divided by a raised median barrier","Drivers should slow to 25 mph but stopping is not required in most cases","Stop only when the bus driver activates hand signals directed at you",B
NY-030,insurance,NY,"What happens if you drive without insurance in New York?","First offense results in a written warning with no immediate consequences","License and registration revocation plus fines may be imposed","Points are added to your record but no suspension occurs for first offense","A small fine is typical for first-time offenders with no other penalties",B
NC-011,gdlLicensing,NC,"What happens if a North Carolina provisional driver is convicted of a moving violation?","A written warning is issued with no impact on the provisional license","Extended restrictions and possible license suspension may result","Points are added to the record but no suspension occurs for conviction","A fine is assessed but the provisional license period remains unchanged",B
OK-010,gdlLicensing,OK,"What happens if an Oklahoma intermediate driver commits violations?","A written warning is issued with no impact on the intermediate license","Extended restrictions and possible license suspension may result","Points are added to the record but no suspension occurs for violation","A fine is assessed but the intermediate license remains unchanged",B
RI-040,stateUnique,RI,"What should Rhode Island drivers know about winter driving?","Winters in Rhode Island are mild with minimal snow or ice concerns","Winters can bring snow and ice requiring extra caution on roads","Significant snowfall is rare and roads are cleared within hours","Tire chains are required by law on all vehicles during winter",B
SD-030,insurance,SD,"What happens if you drive without insurance in South Dakota?","First offense results in a written warning with no immediate consequences","Fines and license and registration suspension may be imposed","Points are added to your record but no suspension occurs for first offense","A small fine is typical for first-time offenders with no other penalties",B
